{
  "$schema": "https://json-schema.org/draft/2020-12/schema",
  "$id": "https://awesome-alternatives.com/schema/catalog.schema.json",
  "title": "Catalog",
  "type": "object",
  "additionalProperties": false,
  "required": ["stats", "checkedAt", "owners", "tools", "products", "categories"],
  "properties": {
    "checkedAt": { "$ref": "#/$defs/timestamp" },
    "stats": {
      "type": "object",
      "additionalProperties": false,
      "required": ["tools", "categories", "targets"],
      "properties": {
        "tools": { "type": "integer", "minimum": 0 },
        "categories": { "type": "integer", "minimum": 0 },
        "targets": { "type": "integer", "minimum": 0 },
        "verified": { "type": "integer", "minimum": 0 }
      }
    },
    "owners": {
      "type": "object",
      "additionalProperties": { "$ref": "#/$defs/owner" }
    },
    "tools": {
      "type": "array",
      "items": { "$ref": "#/$defs/tool" }
    },
    "products": {
      "type": "array",
      "items": { "$ref": "#/$defs/product" }
    },
    "banned": {
      "type": "array",
      "items": { "$ref": "#/$defs/banned" }
    },
    "categories": {
      "type": "object",
      "additionalProperties": { "$ref": "#/$defs/category" }
    },
    "categoryRedirects": {
      "description": "Merged categories, keyed by the old slug, each naming the category that took its tools.",
      "type": "object",
      "propertyNames": { "pattern": "^[a-z0-9]+(-[a-z0-9]+)*$" },
      "additionalProperties": { "type": "string", "pattern": "^[a-z0-9]+(-[a-z0-9]+)*$" }
    }
  },
  "$defs": {
    "banned": {
      "type": "object",
      "additionalProperties": false,
      "required": ["slug", "name", "repository", "category", "reason"],
      "properties": {
        "slug": { "type": "string", "pattern": "^[a-z0-9]+(-[a-z0-9]+)*$" },
        "name": { "type": "string", "minLength": 1 },
        "repository": { "type": "string", "pattern": "^https://github\\.com/[A-Za-z0-9-]+/[A-Za-z0-9._-]+$" },
        "category": { "type": "string", "pattern": "^[a-z0-9]+(-[a-z0-9]+)*$" },
        "reason": { "type": "string", "minLength": 1, "maxLength": 300 }
      }
    },
    "category": {
      "type": "object",
      "additionalProperties": false,
      "required": ["name", "description"],
      "properties": {
        "name": { "type": "string", "minLength": 1 },
        "group": { "type": "string", "pattern": "^[a-z0-9]+(-[a-z0-9]+)*$" },
        "description": { "type": "string", "minLength": 1 },
        "selfHost": { "type": "boolean" },
        "capabilities": { "type": "object", "additionalProperties": {"type": "object", "additionalProperties": false, "required": ["label", "match"], "properties": {"label": {"type": "string", "minLength": 1}, "match": {"type": "array", "items": {"type": "string", "minLength": 1}}}} }
      }
    },
    "product": {
      "type": "object",
      "additionalProperties": false,
      "required": ["slug", "name", "homepage", "vendor", "category", "description"],
      "properties": {
        "slug": { "type": "string", "pattern": "^[a-z0-9]+(-[a-z0-9]+)*$" },
        "name": { "type": "string", "minLength": 1 },
        "homepage": { "type": "string", "pattern": "^https://" },
        "vendor": { "type": "string", "minLength": 1 },
        "category": { "type": "string", "minLength": 1 },
        "description": { "type": "string", "minLength": 1 }
      }
    },
    "timestamp": {
      "type": "string",
      "pattern": "^\\d{4}-\\d{2}-\\d{2}T\\d{2}:\\d{2}:\\d{2}(\\.\\d+)?Z$"
    },
    "tool": {
      "type": "object",
      "additionalProperties": false,
      "required": [
        "slug",
        "name",
        "repository",
        "category",
        "replaces",
        "affiliation",
        "path",
        "addedAt",
        "editedAt",
        "factsChangedAt",
        "repo",
        "release",
        "releases",
        "maintainerVerified",
        "flags",
        "terms",
        "capabilities"
      ],
      "properties": {
        "slug": { "type": "string", "pattern": "^[a-z0-9]+(-[a-z0-9]+)*$" },
        "name": { "type": "string", "minLength": 1 },
        "repository": { "type": "string", "pattern": "^https://github\\.com/[A-Za-z0-9-]+/[A-Za-z0-9._-]+$" },
        "category": { "type": "string", "pattern": "^[a-z0-9]+(-[a-z0-9]+)*$" },
        "replaces": {
          "type": "array",
          "items": {
            "type": "object",
            "additionalProperties": false,
            "required": ["tool", "fit"],
            "properties": {
              "tool": { "type": "string", "pattern": "^[a-z0-9]+(-[a-z0-9]+)*$" },
              "fit": { "enum": ["drop-in", "full", "partial"] },
              "note": { "type": "string", "minLength": 1 },
              "migration": { "type": "string", "pattern": "^https://" }
            }
          }
        },
        "affiliation": { "type": ["string", "null"], "minLength": 1 },
        "path": { "type": ["string", "null"], "minLength": 1 },
        "addedAt": { "$ref": "#/$defs/timestamp" },
        "editedAt": { "$ref": "#/$defs/timestamp" },
        "factsChangedAt": { "oneOf": [{ "$ref": "#/$defs/timestamp" }, { "type": "null" }] },
        "repo": { "$ref": "#/$defs/repo" },
        "owner": {
      "type": "object",
      "additionalProperties": false,
      "required": ["login", "kind", "name", "bio", "website", "url"],
      "properties": {
        "login": { "type": "string", "minLength": 1 },
        "kind": { "enum": ["user", "organization"] },
        "name": { "type": ["string", "null"] },
        "bio": { "type": ["string", "null"] },
        "website": { "type": ["string", "null"] },
        "url": { "type": "string", "minLength": 1 }
      }
    },
    "trend": { "oneOf": [{ "$ref": "#/$defs/trend" }, { "type": "null" }] },
        "starHistory": { "$ref": "#/$defs/starHistory" },
        "release": { "oneOf": [{ "$ref": "#/$defs/release" }, { "type": "null" }] },
        "releases": { "type": "array", "items": { "$ref": "#/$defs/releaseEntry" } },
        "contributors": { "oneOf": [{ "$ref": "#/$defs/contributors" }, { "type": "null" }] },
        "platforms": { "type": "array", "items": { "$ref": "#/$defs/platform" } },
        "maintainerVerified": { "type": "boolean" },
        "verifiedAt": { "oneOf": [{ "$ref": "#/$defs/timestamp" }, { "type": "null" }] },
        "flags": { "type": "array", "items": { "type": "string", "minLength": 1 } },
        "terms": { "enum": ["open", "source-available", "open-core", "unknown"] },
        "capabilities": {"type": "object", "additionalProperties": {"type": "object", "additionalProperties": false, "required": ["docs"], "properties": {"docs": {"type": "string", "pattern": "^https://"}, "note": {"type": "string", "minLength": 1}}}},
        "deploy": { "type": "array", "uniqueItems": true, "items": { "enum": ["container", "compose", "helm", "binary", "package"] } },
        "maintainerFields": {
          "type": "array",
          "uniqueItems": true,
          "items": { "type": "string", "pattern": "^(path|deploy|capabilities\\.[a-z0-9]+(-[a-z0-9]+)*|migration\\.[a-z0-9]+(-[a-z0-9]+)*)$" }
        }
      }
    },
    "repo": {
      "type": "object",
      "additionalProperties": false,
      "required": [
        "fullName",
        "description",
        "homepage",
        "language",
        "license",
        "stars",
        "forks",
        "topics",
        "archived",
        "fork",
        "private",
        "createdAt",
        "pushedAt",
        "defaultBranch"
      ],
      "properties": {
        "fullName": { "type": "string", "minLength": 1 },
        "databaseId": { "type": "integer", "minimum": 1 },
        "description": { "type": ["string", "null"] },
        "homepage": { "type": ["string", "null"] },
        "language": { "type": ["string", "null"] },
        "license": { "type": ["string", "null"] },
        "stars": { "type": "integer", "minimum": 0 },
        "forks": { "type": "integer", "minimum": 0 },
        "topics": { "type": "array", "items": { "type": "string" } },
        "archived": { "type": "boolean" },
        "fork": { "type": "boolean" },
        "private": { "type": "boolean" },
        "createdAt": { "$ref": "#/$defs/timestamp" },
        "pushedAt": { "$ref": "#/$defs/timestamp" },
        "defaultBranch": { "type": "string", "minLength": 1 }
      }
    },
    "owner": {
      "type": "object",
      "additionalProperties": false,
      "required": ["login", "kind", "name", "bio", "website", "url"],
      "properties": {
        "login": { "type": "string", "minLength": 1 },
        "kind": { "enum": ["user", "organization"] },
        "name": { "type": ["string", "null"] },
        "bio": { "type": ["string", "null"] },
        "website": { "type": ["string", "null"] },
        "url": { "type": "string", "minLength": 1 }
      }
    },
    "trend": {
      "type": "object",
      "additionalProperties": false,
      "required": ["stars", "exact", "since"],
      "properties": {
        "stars": { "type": "integer", "minimum": 0 },
        "exact": { "type": "boolean" },
        "since": { "$ref": "#/$defs/timestamp" }
      }
    },
    "starHistory": {
      "type": "object",
      "additionalProperties": false,
      "required": ["from", "stars"],
      "properties": {
        "from": { "type": "string", "pattern": "^\\d{4}-\\d{2}-\\d{2}$" },
        "stars": { "type": "array", "minItems": 1, "maxItems": 32, "items": { "type": "integer", "minimum": 0 } }
      }
    },
    "release": {
      "type": "object",
      "additionalProperties": false,
      "required": ["tag", "publishedAt", "url", "source", "signed"],
      "properties": {
        "tag": { "type": "string", "minLength": 1 },
        "publishedAt": { "oneOf": [{ "$ref": "#/$defs/timestamp" }, { "type": "null" }] },
        "url": { "type": "string", "minLength": 1 },
        "source": { "enum": ["release", "tag", "package"] },
        "signed": { "type": "boolean" },
        "tagOid": { "type": "string", "pattern": "^[0-9a-f]{40}$" }
      }
    },
    "contributors": {
      "type": "object",
      "additionalProperties": false,
      "required": ["count", "capped"],
      "properties": {
        "count": { "type": "integer", "minimum": 0 },
        "capped": { "type": "boolean" }
      }
    },
    "platform": {
      "type": "object",
      "additionalProperties": false,
      "required": ["os", "architectures"],
      "properties": {
        "os": { "enum": ["linux", "macos", "windows", "freebsd", "openbsd", "netbsd", "android"] },
        "architectures": {
          "type": "array",
          "uniqueItems": true,
          "items": { "enum": ["x86_64", "arm64", "x86", "armv7", "arm", "riscv64", "ppc64le", "s390x", "universal"] }
        }
      }
    },
    "releaseEntry": {
      "type": "object",
      "additionalProperties": false,
      "required": ["tag", "name", "publishedAt", "url", "prerelease"],
      "properties": {
        "tag": { "type": "string", "minLength": 1 },
        "name": { "type": ["string", "null"] },
        "publishedAt": { "oneOf": [{ "$ref": "#/$defs/timestamp" }, { "type": "null" }] },
        "url": { "type": "string", "minLength": 1 },
        "prerelease": { "type": "boolean" }
      }
    }
  }
}
